{
  "$schema": "https://json-schema.org/draft/2020-12/schema",
  "$id": "https://kbengine.org/schemas/sdk-validation.schema.json",
  "title": "KBEngine SDK validation manifest",
  "type": "object",
  "additionalProperties": false,
  "required": ["schemaVersion", "sdks"],
  "properties": {
    "schemaVersion": {
      "const": 1
    },
    "workingDirectory": {
      "type": "string",
      "minLength": 1
    },
    "resultsDirectory": {
      "type": "string",
      "minLength": 1
    },
    "variables": {
      "type": "object",
      "additionalProperties": {
        "type": ["string", "number", "boolean"]
      }
    },
    "environment": {
      "type": "object",
      "additionalProperties": {
        "type": ["string", "number", "boolean"]
      }
    },
    "sdks": {
      "type": "array",
      "minItems": 1,
      "items": {
        "$ref": "#/$defs/sdk"
      }
    }
  },
  "$defs": {
    "sdk": {
      "type": "object",
      "additionalProperties": false,
      "required": ["name"],
      "properties": {
        "name": {
          "enum": ["csharp", "cxx", "typescript", "gdscript"]
        },
        "generate": {
          "$ref": "#/$defs/stage"
        },
        "build": {
          "$ref": "#/$defs/stage"
        },
        "run": {
          "$ref": "#/$defs/stage"
        },
        "scenarios": {
          "type": "array",
          "minItems": 1,
          "items": {
            "$ref": "#/$defs/scenario"
          }
        }
      },
      "anyOf": [
        { "required": ["generate"] },
        { "required": ["build"] },
        { "required": ["run"] },
        { "required": ["scenarios"] }
      ]
    },
    "stage": {
      "allOf": [
        { "$ref": "#/$defs/command" }
      ],
      "unevaluatedProperties": false
    },
    "scenario": {
      "allOf": [
        { "$ref": "#/$defs/command" },
        {
          "type": "object",
          "required": ["name"],
          "properties": {
            "name": {
              "type": "string",
              "pattern": "^[A-Za-z0-9][A-Za-z0-9._-]*$"
            }
          }
        }
      ],
      "unevaluatedProperties": false
    },
    "command": {
      "type": "object",
      "required": ["file"],
      "properties": {
        "file": {
          "type": "string",
          "minLength": 1
        },
        "arguments": {
          "type": "array",
          "items": {
            "type": ["string", "number", "boolean"]
          }
        },
        "workingDirectory": {
          "type": "string",
          "minLength": 1
        },
        "environment": {
          "type": "object",
          "additionalProperties": {
            "type": ["string", "number", "boolean"]
          }
        },
        "timeoutSeconds": {
          "type": "integer",
          "minimum": 1
        },
        "requiredPatterns": {
          "type": "array",
          "items": {
            "type": "string"
          }
        },
        "forbiddenPatterns": {
          "type": "array",
          "items": {
            "type": "string"
          }
        }
      }
    }
  }
}
